{
  "contract_version": "0.1",
  "document_type": "azure_migration_hld",
  "binding": {
    "schema_version": "1.1",
    "source_sha256": "b1788e914183ed574649725b64cbe6dc358bc2f2b0ca42a1117a9035ac93a691",
    "profile_sha256": "f0a062c711d2044ad9696e22d18f70d5f55bb6274b2d9af5adf6f9d36f56f640"
  },
  "fields": {
    "customer_brand": {
      "type": "placeholder",
      "target": "body.p0",
      "token": "CUSTOMER",
      "required": true,
      "data_path": "/customer/name"
    },
    "control_customer": {
      "type": "table_cell",
      "target": "body.t0.r1.c1",
      "required": true,
      "data_path": "/customer/name"
    },
    "control_project": {
      "type": "table_cell",
      "target": "body.t0.r2.c1",
      "required": true,
      "data_path": "/project/name"
    },
    "control_sponsor": {
      "type": "table_cell",
      "target": "body.t0.r3.c1",
      "required": true,
      "data_path": "/project/sponsor"
    },
    "control_owner": {
      "type": "table_cell",
      "target": "body.t0.r4.c1",
      "required": true,
      "data_path": "/project/owner"
    },
    "control_start": {
      "type": "table_cell",
      "target": "body.t0.r5.c1",
      "required": true,
      "data_path": "/project/target_start"
    },
    "control_completion": {
      "type": "table_cell",
      "target": "body.t0.r6.c1",
      "required": true,
      "data_path": "/project/target_completion"
    },
    "executive_summary": {
      "type": "text",
      "target": "body.p7",
      "required": true,
      "data_path": "/project/scope"
    },
    "current_state_observations": {
      "type": "table_rows",
      "target": "body.t1",
      "required": true,
      "template_row": 1,
      "columns": {
        "category": 0,
        "observation": 1,
        "impact": 2
      },
      "data_path": "/current_state_observations"
    },
    "application_inventory": {
      "type": "table_rows",
      "target": "body.t2",
      "required": true,
      "template_row": 1,
      "columns": {
        "id": 0,
        "name": 1,
        "owner": 2,
        "business_criticality": 3,
        "current_hosting": 4,
        "data_classification": 5,
        "migration_disposition": 6
      },
      "data_path": "/application_inventory"
    },
    "target_services": {
      "type": "table_rows",
      "target": "body.t3",
      "required": true,
      "template_row": 1,
      "columns": {
        "workload": 0,
        "azure_service": 1,
        "region": 2,
        "rationale": 3
      },
      "data_path": "/proposed_azure_target_services"
    },
    "migration_waves": {
      "type": "table_rows",
      "target": "body.t4",
      "required": true,
      "template_row": 1,
      "columns": {
        "wave": 0,
        "name": 1,
        "application_ids": 2,
        "target_start": 3,
        "target_end": 4,
        "exit_criteria": 5
      },
      "data_path": "/migration_waves"
    },
    "security_requirements": {
      "type": "table_rows",
      "target": "body.t5",
      "required": true,
      "template_row": 1,
      "columns": {
        "id": 0,
        "requirement": 1,
        "priority": 2
      },
      "data_path": "/security_and_networking_requirements/security"
    },
    "networking_requirements": {
      "type": "table_rows",
      "target": "body.t6",
      "required": true,
      "template_row": 1,
      "columns": {
        "id": 0,
        "requirement": 1,
        "priority": 2
      },
      "data_path": "/security_and_networking_requirements/networking"
    },
    "risks": {
      "type": "table_rows",
      "target": "body.t7",
      "required": true,
      "template_row": 1,
      "columns": {
        "id": 0,
        "description": 1,
        "likelihood": 2,
        "impact": 3,
        "mitigation": 4
      },
      "data_path": "/risks_and_assumptions/risks"
    },
    "assumptions": {
      "type": "table_rows",
      "target": "body.t8",
      "required": true,
      "template_row": 1,
      "columns": {
        "id": 0,
        "description": 1,
        "validation_owner": 2
      },
      "data_path": "/risks_and_assumptions/assumptions"
    },
    "design_decisions": {
      "type": "table_rows",
      "target": "body.t9",
      "required": true,
      "template_row": 1,
      "columns": {
        "id": 0,
        "decision": 1,
        "owner": 2,
        "due_date": 3,
        "status": 4
      },
      "data_path": "/outstanding_design_decisions"
    },
    "source_infrastructure": {
      "type": "table_rows",
      "target": "body.t10",
      "required": true,
      "template_row": 1,
      "columns": {
        "id": 0,
        "name": 1,
        "category": 2,
        "location": 3,
        "quantity": 4,
        "operating_system": 5,
        "specification": 6
      },
      "data_path": "/source_infrastructure_inventory"
    },
    "application_dependencies": {
      "type": "table_rows",
      "target": "body.t11",
      "required": true,
      "template_row": 1,
      "columns": {
        "source_application_id": 0,
        "target_application_id": 1,
        "dependency_type": 2,
        "notes": 3
      },
      "data_path": "/application_dependencies"
    }
  }
}